{
  "schema": "sensor.report.v1",
  "tool": { "name": "conform-test", "version": "1.0.0" },
  "run": { "started_at": "2026-01-01T00:00:00Z" },
  "verdict": {
    "status": "fail",
    "counts": { "info": 1, "warn": 1, "error": 1 },
    "reasons": ["compilation_failed"]
  },
  "findings": [
    { "severity": "info", "code": "A001", "message": "info msg", "location": { "path": "a.rs", "line": 1 } },
    { "severity": "error", "code": "B001", "message": "error msg", "location": { "path": "b.rs", "line": 10 } },
    { "severity": "warn", "code": "C001", "message": "warn msg", "location": { "path": "c.rs", "line": 5 } }
  ]
}
