{
  "schema": "sensor.report.v1",
  "tool": { "name": "t", "version": "1" },
  "run": { "started_at": "2026-01-01T00:00:00Z" },
  "verdict": { "status": "fail", "counts": { "info": 0, "warn": 0, "error": 2 } },
  "findings": [
    { "severity": "error", "code": "A", "message": "no location" },
    { "severity": "error", "code": "B", "message": "path only", "location": { "path": "f.rs" } }
  ]
}
