{
  "schema": "builddiag.report.v1",
  "tool": {
    "name": "builddiag",
    "version": "0.7.1"
  },
  "run": {
    "started_at": "2026-02-02T11:59:00Z"
  },
  "verdict": {
    "status": "pass",
    "counts": {
      "info": 0,
      "warn": 0,
      "error": 0
    },
    "reasons": []
  },
  "findings": []
}
