{
  "schema": "sensor.report.v1",
  "tool": { "name": "edge", "version": "0" },
  "run": { "started_at": "2026-01-01T00:00:00Z" },
  "verdict": { "status": "pass", "counts": { "info": 0, "warn": 0, "error": 0 } },
  "findings": [
    { "severity": "info", "code": "X", "message": "m", "location": { "path": "f", "line": 0 } },
    { "severity": "info", "code": "X", "message": "m", "location": { "path": "f", "line": -1 } },
    { "severity": "info", "code": "X", "message": "m", "location": { "path": "f", "line": 2147483647 } },
    { "severity": "info", "code": "X", "message": "m", "location": { "path": "f", "line": 4294967295 } }
  ]
}
