{
  "schema": "sensor.report.v1",
  "tool": {
    "name": "bigsensor",
    "version": "1.0.0"
  },
  "run": {
    "started_at": "2026-02-02T12:00:00Z"
  },
  "verdict": {
    "status": "pass",
    "counts": {
      "info": 0,
      "warn": 0,
      "error": 0
    },
    "reasons": []
  },
  "findings": []
}
