{
  "schema": "sensor.report.v1",
  "tool": { "name": "conform-fuzz", "version": "1.0.0" },
  "run": { "started_at": "2026-01-01T00:00:00Z" },
  "verdict": {
    "status": "fail",
    "counts": { "info": 4294967295, "warn": 4294967295, "error": 4294967295 },
    "reasons": []
  },
  "findings": [
    {
      "severity": "error",
      "code": "X",
      "message": "m",
      "location": { "path": "f", "line": 4294967295, "col": 4294967295 }
    }
  ]
}
