{
  "schema": "sensor.report.v1",
  "tool": { "name": "ünïcödé", "version": "1.0.0" },
  "run": { "started_at": "2026-01-01T00:00:00Z" },
  "verdict": { "status": "warn", "counts": { "info": 0, "warn": 1, "error": 0 }, "reasons": ["日本語"] },
  "findings": [
    { "severity": "warn", "code": "ÜNÏCÖDÉ", "message": "中文消息 🎉🚀✨ العربية", "location": { "path": "src/日本語/テスト.rs", "line": 1 } }
  ]
}
