{
  "schema": "sensor.report.v1",
  "tool": { "name": "lint", "version": "0.1.0" },
  "run": { "started_at": "2026-01-01T00:00:00Z" },
  "verdict": {
    "status": "warn",
    "counts": { "info": 0, "warn": 1, "error": 0 }
  },
  "findings": [
    {
      "severity": "warn",
      "code": "W001",
      "message": "unused import"
    }
  ]
}
