{
  "schema": "sensor.report.v1",
  "tool": { "name": "nested", "version": "1.0.0" },
  "run": { "started_at": "2026-01-01T00:00:00Z" },
  "verdict": {
    "status": "pass",
    "counts": { "info": 1, "warn": 0, "error": 0 }
  },
  "findings": [
    {
      "severity": "info",
      "code": "NESTED",
      "message": "finding with complex tool_specific data",
      "data": {
        "metrics": {
          "coverage": { "lines": 95.2, "branches": 87.1, "functions": 92.0 },
          "complexity": { "cyclomatic": [1, 2, 3, 15, 42], "cognitive": [0, 1, 5] },
          "duplication": { "blocks": [], "percentage": 0.0 }
        },
        "dependencies": [
          { "name": "serde", "version": "1.0.200", "features": ["derive", "alloc"] },
          { "name": "tokio", "version": "1.37.0", "features": ["full"] }
        ],
        "config": {
          "rules": { "enabled": ["all"], "disabled": ["style.line_length"] },
          "thresholds": { "error": 0, "warn": 5, "info": null },
          "flags": { "strict": true, "verbose": false, "dry_run": false }
        },
        "nested_arrays": [[1, [2, [3, [4, [5]]]]]],
        "mixed_types": [null, true, false, 0, -1, 1.5e10, "", "text", [], {}],
        "empty_objects": { "a": {}, "b": { "c": {} } }
      }
    }
  ],
  "data": {
    "pipeline": {
      "stages": [
        { "name": "checkout", "duration_ms": 1200, "status": "ok" },
        { "name": "build", "duration_ms": 45000, "status": "ok" },
        { "name": "test", "duration_ms": 120000, "status": "ok" }
      ]
    }
  }
}
