{
  "schema": "sensor.report.v1",
  "tool": { "name": "reason-lint", "version": "1.0.0" },
  "run": { "started_at": "2026-01-01T00:00:00Z" },
  "verdict": {
    "status": "fail",
    "counts": { "info": 0, "warn": 0, "error": 3 },
    "reasons": [
      "VALID_TOKEN",
      "invalid token with spaces",
      "123_numeric_start",
      "",
      "has.dots.in.it",
      "has-dashes-and_underscores",
      "ALLCAPS",
      "MiXeD_CaSe_ToKeN"
    ]
  },
  "findings": [
    { "severity": "error", "code": "T1", "message": "a" },
    { "severity": "error", "code": "T2", "message": "b" },
    { "severity": "error", "code": "T3", "message": "c" }
  ]
}
