{
  "schema": "sensor.report.v1",
  "tool": { "name": "t", "version": "1" },
  "run": { "started_at": "2026-01-01T00:00:00Z" },
  "verdict": { "status": "fail", "counts": { "info": 99, "warn": 99, "error": 99 } },
  "findings": [
    { "severity": "error", "code": "X", "message": "only one finding but counts say 99" }
  ]
}
